id,User Story,refair_domain,refair_ml_tasks,refair_features,refair_features_por_task,ml_task_vazio,erro
A1US1Ge,"As a driver, I want a car that uses AI and real-time data to react faster than humans in emergency situations, reducing my risk of accidents.",News,,,,Sim,
A1US2Ge,"As a city planner, I want a traffic management system that uses AI and connected vehicles to optimize traffic flow and reduce congestion.",Movies,ranking; representation learning,age; gender,"ranking: age, gender | representation learning: age, gender",Não,
A1US3Ge,"As a car manufacturer, I want to develop AVs with advanced sensors and AI algorithms that can accurately perceive their surroundings and make safe driving decisions.",Health,,,,Sim,
A1US4Ge,"As a blind or visually impaired person, I want an AV that can safely navigate me around town, giving me greater independence.",Biology,classification,,classification: —,Não,
A1US5Ge,"As an environmentalist, I want AVs that are programmed for fuel efficiency and can reduce overall emissions and pollution in our cities.",Education,data summarization,age; caste; gender; geography; race; sex,"data summarization: age, caste, gender, geography, race, sex",Não,
A1US6Ge,"As a busy professional, I want an AV that can take me to meetings or appointments while I work on other tasks, saving me valuable time.",Health,,,,Sim,
A1US7Ge,"As a safety advocate, I want clear regulations and safety standards for AVs to ensure the well- being of all road users.",Literature,clustering; ranking,author; gender; textual references to people and their demographics,"clustering: author, gender, textual references to people and their demographics | ranking: gender",Não,
A1US8Ge,"As a cybersecurity expert, I want AVs to be equipped with robust security measures to protect them from hacking and cyberattacks.",Biology,,,,Sim,
A1US9Ge,"As a data privacy advocate, I want control over the data collected by AVs and ensure it's used responsibly and securely.",Health,,,,Sim,
A1US10Ge,"As a delivery company, I want to explore the use of AVs for efficient and cost-effective last-mile delivery services.",Plant Science,,,,Sim,
A1US1Ll,"As a researcher, I want to explore the possibilities of Artificial Intelligence (AI) in enabling the smart industrial revolution, so that I can contribute to the development of innovative solutions for industry 4.0.",Medicine,classification; classification,age; race; sex; ethnicity; gender,"classification: age, race, sex, ethnicity, gender",Não,
A1US2Ll,"As an engineer, I want to design and develop Internet of Things (IoT) infrastructure that can collect and process data from various sources, including storage, actuation, sensing, advanced services, and communication technologies, so that I can enable the transformation towards fully smart Autonomous Vehicles (AVs).",Education,classification; regression; representation learning,age; geography; race; sex; ethnicity; family wealth; gender; financial status,"classification: age, geography, race, sex, ethnicity, family wealth, gender | regression: age, ethnicity, financial status, gender, geography, race, sex | representation learning: age, ethnicity, financial status, gender, geography, race, sex",Não,
A1US3Ll,"As a safety expert, I want to utilize AI and IoT to reduce the risk of accidents and improve vehicle safety, so that I can minimize the likelihood of human error and ensure a safer driving experience.",Law,,,,Sim,
A1US4Ll,"As a driver, I want to benefit from the increased safety and reduced accidents that Autonomous Vehicles (AVs) can provide, so that I can feel more confident and secure on the road.",News,,,,Sim,
A1US5Ll,"As a business owner, I want to explore the new market opportunities and revenue streams that Autonomous Vehicles (AVs) can offer, so that I can expand my business and stay competitive in the industry.",Biology,,,,Sim,
A1US6Ll,"As a fleet manager, I want to reduce fuel consumption and emissions by using Autonomous Vehicles (AVs), so that I can minimize my organization's environmental footprint and save on fuel costs.",Literature,clustering,author; gender; textual references to people and their demographics,"clustering: author, gender, textual references to people and their demographics",Não,
A1US7Ll,"As a passenger, I want to enjoy the increased comfort and convenience of Autonomous Vehicles (AVs), including the release of driver time and business opportunities, so that I can be more productive and relaxed during my journey.",Literature,,,,Sim,
A1US8Ll,"As a developer, I want to design and develop AI-powered Autonomous Vehicles (AVs) that can process large- scale data from sensors and devices, so that I can create a more efficient and reliable transportation system.",Medicine,,,,Sim,
A1US9Ll,"As a regulator, I want to ensure that Autonomous Vehicles (AVs) meet the highest safety standards and are tested rigorously to minimize risk, so that I can protect the public and ensure a safe and reliable transportation system.",Biology,,,,Sim,
A1US10Ll,"As a commuter, I want to benefit from the reduced traffic congestion and parking needs that Autonomous Vehicles (AVs) can provide, so that I can save time and reduce stress during my daily commute.",Biology,classification,,classification: —,Não,
A1US1O1,"As a passenger, I want the AV to detect hazards in real-time using AI sensors, so that my safety is ensured.",Literature,,,,Sim,
A1US2O1,"As a fleet manager, I want to monitor AV performance data via IoT, so that I can proactively manage maintenance.",Literature,ranking,gender,ranking: gender,Não,
A1US3O1,"As a driver, I want the AV to predict and prevent collisions using AI, so that accidents are significantly reduced.",News,bias detection in word embeddings; clustering; ranking,textual references to people and their demographics; author; geography; news provider,"bias detection in word embeddings: textual references to people and their demographics | clustering: author, geography, textual references to people and their demographics | ranking: geography, news provider",Não,
A1US4O1,"As a transportation executive, I want the AV to optimize fuel consumption with AI, so that operational costs are minimized.",Transportation,,,,Sim,
A1US5O1,"As a passenger, I want the AV to navigate autonomously through traffic using AI and IoT, so that my travel is seamless and stress-free.",Literature,,,,Sim,
A1US6O1,"As a commuter, I want the AV to handle driving tasks autonomously, so that I can use my travel time productively.",Biology,classification,,classification: —,Não,
A1US7O1,"As an environmental advocate, I want the AV to reduce emissions through AI-optimized routes, so that it contributes to a cleaner environment.",Education,data summarization,age; caste; gender; geography; race; sex,"data summarization: age, caste, gender, geography, race, sex",Não,
A1US8O1,"As a software engineer, I want the AV to efficiently process large-scale sensor data using AI and IoT, so that it makes informed decisions quickly.",Literature,,,,Sim,
A1US9O1,"As a business strategist, I want to leverage AI and IoT in AVs to explore new market opportunities, so that the company can expand its revenue streams.",Biology,,,,Sim,
A1US10O1,"As a network administrator, I want the AV to maintain low- latency connectivity through IoT, so that it can communicate effectively for safe operations.",Computer Networks,,,,Sim,
A2US1Ge,"As a parent, I want a device that can track my child's physical activity and potentially identify aggressive episodes so that I can intervene and provide support.",Music,,,,Sim,
A2US2Ge,"As a teacher, I want a tool that can discreetly monitor student activity levels in the classroom and alert me to potential aggression so that I can de-escalate situations before they escalate.",News,bias detection in word embeddings; clustering; ranking,textual references to people and their demographics; author; geography; news provider,"bias detection in word embeddings: textual references to people and their demographics | clustering: author, geography, textual references to people and their demographics | ranking: geography, news provider",Não,
A2US3Ge,"As a therapist working with aggressive children, I want objective data on their physical activity patterns to track progress in anger management and de-escalation techniques.",Biology,,,,Sim,
A2US4Ge,"As a researcher studying childhood aggression, I want access to a non- invasive method for collecting real-time data on physical aggression in children so that I can better understand its triggers and consequences.",Health,,,,Sim,
A2US5Ge,"As a school administrator, I want a system that helps identify students at risk of aggressive behavior so that I can implement targeted interventions and create a safer learning environment.",Movies,representation learning,age; gender,"representation learning: age, gender",Não,
A2US6Ge,"As a child with a history of aggression, I want a wearable device that helps me and my parents monitor my activity levels and receive alerts when aggressive behavior might be escalating.",News,bias detection in word embeddings; clustering,textual references to people and their demographics; author; geography,"bias detection in word embeddings: textual references to people and their demographics | clustering: author, geography, textual references to people and their demographics",Não,
A2US7Ge,"As a healthcare provider working with children with ADHD, I want a tool that can differentiate between ADHD- related hyperactivity and physical aggression so that I can provide the most appropriate treatment.",Health,regression,age; ethnicity; gender; geography; sex,"regression: age, ethnicity, gender, geography, sex",Não,
A2US8Ge,"As a developer of wearable technology for children, I want to integrate machine learning models for aggression detection into my devices to provide parents and educators with additional insights into children's behavior.",Biology,,,,Sim,
A2US9Ge,"As a data privacy advocate, I want assurances that any wearable device used for aggression detection collects data securely and protects children's privacy.",Linguistics,,,,Sim,
A2US10Ge,"As a policymaker, I want to explore the potential of wearable-based aggression detection for early intervention programs and violence prevention initiatives in schools and childcare settings.",Finance & Marketing,anomaly detection,age; gender; race; sex,"anomaly detection: age, gender, race, sex",Não,
A2US1Ll,"As a researcher, I want to develop an objective method to track physical- aggressive incidents in children, so that I can identify early warning signs and provide timely interventions.",Biology,,,,Sim,
A2US2Ll,"As a parent, I want to know if my child is experiencing aggressive episodes, so that I can provide support and guidance to help them manage their emotions and behaviors.",Music,,,,Sim,
A2US3Ll,"As a clinician, I want to use wearable-sensor- derived physical activity data to identify patterns that distinguish physical-aggressive incidents in children, so that I can develop targeted treatments and interventions.",Medicine,classification; classification,age; race; sex; ethnicity; gender,"classification: age, race, sex, ethnicity, gender",Não,
A2US4Ll,"As a data analyst, I want to apply machine learning techniques (e.g., random forest) to analyze physical activity data and identify physical- aggressive incidents with high precision and accuracy, so that I can contribute to the development of an objective detection method.",Biology,classification; graph mining,,classification: — | graph mining: —,Não,
A2US5Ll,"As a researcher, I want to collect demographic, anthropometric, and clinical data from participants to better understand the context and contributing factors of physical- aggressive incidents in children, so that I can develop a more comprehensive understanding of the phenomenon.",Biology,classification; graph mining,,classification: — | graph mining: —,Não,
A2US6Ll,"As a developer, I want to design a wearable device (e.g., waist-worn activity monitor) that can track physical activity data in children and transmit it to a remote server for analysis, so that I can enable remote monitoring and detection of physical-aggressive incidents.",Movies,data summarization; ranking; representation learning,age; gender,"data summarization: age, gender | ranking: age, gender | representation learning: age, gender",Não,
A2US7Ll,"As a parent, I want to receive alerts and notifications when my child experiences a physical-aggressive incident, so that I can provide immediate support and guidance.",Biology,classification,,classification: —,Não,
A2US8Ll,"As a researcher, I want to investigate the effectiveness of the machine learning model in distinguishing physical aggression epochs from non- aggression epochs, so that I can refine and improve the detection algorithm.",Biology,classification,,classification: —,Não,
A2US9Ll,"As a clinician, I want to use the sensor-derived feature of vector magnitude (faster triaxial acceleration) to identify early warning signs of physical-aggressive incidents in children, so that I can develop targeted interventions and prevention strategies.",Biology,classification,,classification: —,Não,
A2US10Ll,"As a system designer, I want to design a scalable and efficient system for remotely detecting and managing aggressive incidents in children, so that I can enable widespread adoption and improve the lives of children and their families.",Biology,,,,Sim,
A2US1O1,"As a parent, I want to receive real-time alerts when my child shows aggressive behavior, so I can intervene immediately.",Music,,,,Sim,
A2US2O1,"As a teacher, I want daily reports on students' aggression levels from wearable sensors, so I can implement effective classroom strategies.",News,bias detection in word embeddings; clustering; ranking,textual references to people and their demographics; author; geography; news provider,"bias detection in word embeddings: textual references to people and their demographics | clustering: author, geography, textual references to people and their demographics | ranking: geography, news provider",Não,
A2US3O1,"As a clinician, I want access to detailed logs of a child's aggressive incidents, so I can create personalized intervention plans.",Medicine,,,,Sim,
A2US4O1,"As a researcher, I want to analyze aggregated sensor data from multiple participants, so I can study the triggers of aggression in children.",Medicine,,,,Sim,
A2US5O1,"As a school administrator, I want to monitor overall aggression data across the school, so I can develop policies to enhance safety.",Movies,representation learning,age; gender,"representation learning: age, gender",Não,
A2US6O1,"As a child with ADHD, I want to wear a comfortable activity monitor, so my behavior is tracked without feeling uncomfortable.",Health,representation learning,age; ethnicity; gender; geography; sex,"representation learning: age, ethnicity, gender, geography, sex",Não,
A2US7O1,"As a data scientist, I want the machine learning model to accurately distinguish between aggressive and non-aggressive activities, so the system reliably identifies true aggression incidents.",Health,classification; representation learning,age; geography; sex; ethnicity; gender,"classification: age, geography, sex, ethnicity, gender | representation learning: age, ethnicity, gender, geography, sex",Não,
A2US8O1,"As a guardian, I want to view trends of my child's aggression incidents over time, so I can understand and support their behavioral development.",Music,,,,Sim,
A2US9O1,"As a privacy officer, I want all sensor data to be securely stored and access- controlled, so children's privacy is protected.",Medicine,classification; classification,age; race; sex; ethnicity; gender,"classification: age, race, sex, ethnicity, gender",Não,
A2US10O1,"As a software developer, I want to integrate sensor data with existing health management systems, so comprehensive support services can be provided seamlessly",Literature,,,,Sim,
A3US1Ge,"As a social media platform developer, I want a system that can detect aggressive content on my platform in real-time so that I can promote a safer and more positive user experience.",Social Media,bias detection in language models; bias detection in word embeddings; classification; ranking; sentiment analysis; speech recognition,gender; political leaning; race; religion; textual references to people and their demographics; age; geography; disability; race/ethnicity; sexual orientation,"bias detection in language models: gender, political leaning, race, religion, textual references to people and their demographics, age, geography | bias detection in word embeddings: race, gender, textual references to people and their demographics | classification: age, geography, race, disability, gender, textual references to people and their demographics, race/ethnicity, religion, sexual orientation | ranking: age, gender, geography, race | sentiment analysis: race | speech recognition: gender, geography",Não,
A3US2Ge,"As a content moderator, I want a tool that identifies potentially aggressive tweets with high accuracy so that I can prioritize them for review and take appropriate action.",Literature,,,,Sim,
A3US3Ge,"As a researcher studying online behavior, I want access to a system that detects aggression on Twitter in real-time so that I can analyze trends and patterns in online discourse.",Health,,,,Sim,
A3US4Ge,"As a user who has been targeted by online aggression, I want a platform that can flag aggressive messages so that I can avoid them and report the abuse.",Transportation,,,,Sim,
A3US5Ge,"As a mental health professional, I want to identify individuals who exhibit aggressive behavior online so that I can offer them support and resources.",Health,,,,Sim,
A3US6Ge,"As a brand manager, I want a system that can detect aggressive mentions of my brand on Twitter so that I can address any negativity and protect our reputation.",Literature,,,,Sim,
A3US7Ge,"As a journalist, I want a tool that helps me identify potential sources of misinformation and disinformation that are spread through aggressive online behavior.",News,,,,Sim,
A3US8Ge,"As a law enforcement officer, I want a system that can detect real- time threats of violence or harm made on social media so that I can intervene and prevent potential crimes.",Biology,classification; graph mining,,classification: — | graph mining: —,Não,
A3US9Ge,"As a developer, I want access to the underlying machine learning model and its training data so that I can integrate this real-time aggression detection framework into other applications.",Biology,,,,Sim,
A3US10Ge,"As a person concerned about online harassment, I want a browser extension or mobile app that filters out potentially aggressive content from my social media feeds so that I can curate a more positive online experience.",News,bias detection in word embeddings; clustering; ranking,textual references to people and their demographics; author; geography; news provider,"bias detection in word embeddings: textual references to people and their demographics | clustering: author, geography, textual references to people and their demographics | ranking: geography, news provider",Não,
A3US1Ll,"As a social media platform administrator, I want to detect aggressive behavior on Twitter in real-time, so that I can prevent online harassment and maintain a safe online environment.",Social Media,,,,Sim,
A3US2Ll,"As a data scientist, I want to develop a machine learning framework that can adapt to new annotated examples and evolve with changing aggressive behavior on social media, so that I can maintain high detection accuracy.",Biology,classification,,classification: —,Não,
A3US3Ll,"As a researcher, I want to compare the performance of our real-time framework with traditional batch- based machine learning models, so that I can demonstrate the effectiveness of our approach.",Biology,classification,,classification: —,Não,
A3US4Ll,"As a system administrator, I want to deploy our framework on a minimal number of commodity machines, so that I can process the entire Twitter Firehose (778 million tweets per day) without excessive resource requirements.",Biology,,,,Sim,
A3US5Ll,"As a social media user, I want to feel safe online and know that aggressive behavior is being detected and addressed in real- time, so that I can engage in online conversations without fear of harassment.",Social Media,,,,Sim,
A3US6Ll,"As a content moderator, I want to receive alerts and notifications about detected aggressive behavior, sarcasm, racism, and sexism on Twitter, so that I can take prompt action to remove harmful content.",Literature,,,,Sim,
A3US7Ll,"As a developer, I want to integrate our real-time framework with existing social media platforms, so that I can provide a seamless user experience and detect aggressive behavior across different platforms.",Medicine,classification; classification,age; race; sex; ethnicity; gender,"classification: age, race, sex, ethnicity, gender",Não,
A3US8Ll,"As a researcher, I want to analyze the performance of our framework on detecting related behaviors such as sarcasm, racism, and sexism, so that I can refine our approach and improve detection accuracy.",Medicine,,,,Sim,
A3US9Ll,"As a social media platform administrator, I want to use our framework to identify trends and patterns of aggressive behavior on Twitter, so that I can develop targeted interventions and prevention strategies.",Social Media,,,,Sim,
A3US10Ll,"As a system designer, I want to design a scalable and flexible architecture for our real-time framework, so that it can easily integrate with new social media platforms and accommodate increasing volumes of user-generated content.",Law,classification; classification; regression; representation learning,age; geography; race; sex; ethnicity; gender,"classification: age, geography, race, sex, ethnicity, gender | regression: age, ethnicity, gender, geography, race, sex | representation learning: age, ethnicity, gender, geography, race, sex",Não,
A3US1O1,"As a social media moderator, I want real-time alerts of aggressive tweets, so I can promptly address and remove harmful content.",Social Media,bias detection in language models; sentiment analysis,gender; political leaning; race; religion; textual references to people and their demographics; age; geography,"bias detection in language models: gender, political leaning, race, religion, textual references to people and their demographics, age, geography | sentiment analysis: race",Não,
A3US2O1,"As a platform administrator, I want the aggression detection system to scale efficiently with Twitter’s data volume, so it can handle up to 778 million tweets daily using minimal resources.",Literature,,,,Sim,
A3US3O1,"As a data scientist, I want the machine learning classifiers to adapt incrementally with new data, so the detection accuracy remains high as aggressive behavior evolves.",Biology,classification,,classification: —,Não,
A3US4O1,"As a researcher, I want to analyze detected aggression, sarcasm, racism, and sexism in real- time, so I can study trends and patterns in online behavior.",Medicine,,,,Sim,
A3US5O1,"As a user, I want aggressive content to be minimized on my Twitter feed, so my online experience is safer and more positive.",Transportation,,,,Sim,
A3US6O1,"As a compliance officer, I want detailed reports on detected aggressive behavior, so I can ensure the platform adheres to community guidelines and regulations.",Plant Science,clustering,,clustering: —,Não,
A3US7O1,"As a developer, I want the framework to integrate seamlessly with existing Twitter infrastructure, so deployment is efficient and does not disrupt service.",Medicine,classification; classification,age; race; sex; ethnicity; gender,"classification: age, race, sex, ethnicity, gender",Não,
A3US8O1,"As a content strategist, I want insights from aggression detection to inform policy updates, so the platform can proactively manage evolving online threats.",Finance & Marketing,data summarization,age; gender; geography; race; sex,"data summarization: age, gender, geography, race, sex",Não,
A3US9O1,"As a marketer, I want to ensure that aggressive or harmful content does not appear alongside advertisements, so brand safety is maintained on the platform.",Finance & Marketing,data summarization,age; gender; geography; race; sex,"data summarization: age, gender, geography, race, sex",Não,
A3US10O1,"As a cybersecurity analyst, I want the system to detect and report coordinated aggressive campaigns, so I can mitigate large- scale harassment or abuse efforts effectively.",Biology,classification,,classification: —,Não,
A4US1Ge,"As a military leader, I want to leverage AI for improved situational awareness and faster decision- making on the battlefield to gain a tactical advantage.",Health,classification; regression; representation learning,age; geography; sex; ethnicity; gender,"classification: age, geography, sex, ethnicity, gender | regression: age, ethnicity, gender, geography, sex | representation learning: age, ethnicity, gender, geography, sex",Não,
A4US2Ge,"As a cybersecurity expert, I want AI tools that can detect and respond to cyberattacks in real-time, protecting critical infrastructure and national security information.",Biology,classification,,classification: —,Não,
