id,User Story,refair_domain,refair_ml_tasks,refair_features,refair_features_por_task,ml_task_vazio,erro
A12US8O1,"As a city planner, I want to integrate FVVI data into urban development plans, so that I can create safer community environments.",Movies,representation learning,age; gender,"representation learning: age, gender",Não,
A12US9O1,"As a law enforcement strategist, I want to leverage the FVVI to identify hotspots for firearm violence, so that I can deploy resources more efficiently.",Biology,graph mining,,graph mining: —,Não,
A12US10O1,"As a public health researcher, I want the FVVI to incorporate diverse population characteristics, so that the model remains robust and inclusive across different urban settings.",Health,classification; matching,age; geography; sex; ethnicity; gender,"classification: age, geography, sex, ethnicity, gender | matching: age, gender, geography",Não,
A13US1Ge,"As a drug researcher, I want to use AI-DrugNet to identify existing drugs that could be repurposed for treating Alzheimer's disease (AD) based on their target interactions.",Literature,,,,Sim,
A13US2Ge,"As a pharmaceutical company scientist, I want the platform to predict potential combinations of existing drugs that may have a synergistic effect in treating AD.",Pharmacology,,,,Sim,
A13US3Ge,"As a neurologist, I want to use AI- DrugNet to explore potential treatment options for my patients with AD that could be readily available based on existing drugs.",Biology,,,,Sim,
A13US4Ge,"As a computational biologist, I want to access the underlying network model and data used in AI-DrugNet to understand the rationale behind the predicted drug repurposing or combinations.",Biology,,,,Sim,
A13US5Ge,"As a data scientist, I want the platform to allow for the integration of additional disease data and drug- target interaction information to expand its applicability to other neurological or developmental disorders.",Health,representation learning,age; ethnicity; gender; geography; sex,"representation learning: age, ethnicity, gender, geography, sex",Não,
A13US6Ge,"As a regulatory scientist, I want the AI-DrugNet predictions to be accompanied by information on the existing safety and efficacy profiles of the repurposed or combined drugs.",Health,classification; regression; representation learning,age; geography; sex; ethnicity; gender,"classification: age, geography, sex, ethnicity, gender | regression: age, ethnicity, gender, geography, sex | representation learning: age, ethnicity, gender, geography, sex",Não,
A13US7Ge,"As a patient advocate, I want the platform to be transparent about the limitations of AI- based predictions and the need for further clinical trials to validate potential drug repurposing or combinations.",Finance & Marketing,anomaly detection; classification; classification; ranking; representation learning,age; gender; race; sex; geography; activity,"anomaly detection: age, gender, race, sex | classification: age, geography, race, sex, gender | ranking: activity, age, gender, geography, race, sex | representation learning: age, gender, geography, race, sex",Não,
A13US8Ge,"As a system developer, I want AI-DrugNet to be user-friendly and allow researchers to input specific drug targets or disease characteristics for focused drug repurposing analysis.",Law,clustering; representation learning,age; ethnicity; gender; geography; race; sex,"clustering: age, ethnicity, gender, geography, race, sex | representation learning: age, ethnicity, gender, geography, race, sex",Não,
A13US9Ge,"As a drug discovery company executive, I want the platform to offer different subscription tiers with access to additional features like detailed network visualizations and prioritized drug recommendations.",Literature,clustering; ranking,author; gender; textual references to people and their demographics,"clustering: author, gender, textual references to people and their demographics | ranking: gender",Não,
A13US10Ge,"As a policymaker, I want to explore how AI-DrugNet can be integrated into drug discovery pipelines to streamline the development of new treatment options for various diseases.",Finance & Marketing,resource allocation,age; race; sex; geography,"resource allocation: age, race, sex, geography",Não,
A13US1Ll,"As a researcher, I want to develop a novel prediction framework to identify potential repurposed drug therapies for Alzheimer's disease (AD), so that I can contribute to the discovery of effective treatments for this complex disease.",Biology,classification,,classification: —,Não,
A13US2Ll,"As a pharmaceutical company, I want to use a deep learning-based framework to identify potential drug combinations for AD, so that I can accelerate the development of therapeutic efficacy for this disease.",Pharmacology,,,,Sim,
A13US3Ll,"As a neurologist, I want to access a database of drug- target pair networks that incorporate multiple drug features and target features, so that I can better understand the complex mechanisms behind AD and identify potential treatment options.",Biology,classification,,classification: —,Não,
A13US4Ll,"As a data scientist, I want to generate integrated features for each drug- combination by incorporating drug- target features and relationship information between drug-drug, target-target, and drug-target, so that I can train a robust AI model for drug discovery.",Health,classification; regression; representation learning,age; geography; sex; ethnicity; gender,"classification: age, geography, sex, ethnicity, gender | regression: age, ethnicity, gender, geography, sex | representation learning: age, ethnicity, gender, geography, sex",Não,
A13US5Ll,"As a medical researcher, I want to use an AI-based Drug discovery Network (AI- DrugNet) to identify potential repurposed and combination drug options for AD, so that I can validate their efficacy in clinical trials.",Medicine,classification; classification,age; race; sex; ethnicity; gender,"classification: age, race, sex, ethnicity, gender",Não,
A13US6Ll,"As a clinician, I want to access a list of predicted potential drug therapies for AD, ranked by their likelihood of success, so that I can discuss treatment options with my patients and their families.",Medicine,,,,Sim,
A13US7Ll,"As a researcher, I want to apply the AI-DrugNet framework to identify potential drug combinations for other diseases beyond AD, so that I can explore its broad applicability and generalizability.",Medicine,,,,Sim,
A13US8Ll,"As a pharmaceutical company, I want to use the AI-DrugNet framework to identify potential drug candidates that can be repurposed for AD, so that I can reduce the costs and risks associated with drug development.",Pharmacology,,,,Sim,
A13US9Ll,"As a bioinformatician, I want to analyze the AD disease network and identify the key nodes and edges that are associated with disease progression, so that I can provide insights on the underlying mechanisms of AD.",Biology,,,,Sim,
A13US10Ll,"As a healthcare policymaker, I want to use the AI- DrugNet framework to inform drug development priorities and resource allocation for AD and other complex diseases, so that I can ensure that patients have access to effective treatments.",Health,,,,Sim,
A13US1O1,"As a neurologist, I want to utilize the AI-DrugNet framework to identify repurposed drugs for Alzheimer's disease, so that I can offer new therapeutic options to my patients.",Biology,classification,,classification: —,Não,
A13US2O1,"As a pharmaceutical researcher, I want to leverage the deep learning- based prediction framework, so that I can discover effective drug combinations for treating complex neurological disorders.",Pharmacology,,,,Sim,
A13US3O1,"As a data scientist, I want to build and analyze a drug- target pair (DTP) network using multiple drug and target features, so that I can uncover meaningful associations within the AD disease network.",Biology,classification,,classification: —,Não,
A13US4O1,"As a bioinformatician, I want to integrate drug-drug, target- target, and drug- target relationships into the AI-DrugNet model, so that the framework can generate comprehensive features for accurate drug prediction.",Biology,classification,,classification: —,Não,
A13US5O1,"As a clinical trial coordinator, I want to use AI-DrugNet to identify potential repurposed drug therapies, so that I can design and initiate clinical trials more efficiently for Alzheimer's disease.",Biology,classification,,classification: —,Não,
A13US6O1,"As a pharmacologist, I want the prediction framework to generalize to other diseases, so that I can apply the same methodology to discover drug combinations for various complex conditions.",Pharmacology,,,,Sim,
A13US7O1,"As a healthcare policymaker, I want to adopt the AI- DrugNet framework for drug repurposing, so that I can support cost- effective and timely therapeutic developments for public health.",Health,,,,Sim,
A13US8O1,"As a machine learning engineer, I want to develop and refine the AI- DrugNet model, so that it exhibits robust predictive performance in identifying effective drug therapies.",Computer Networks,,,,Sim,
A13US9O1,"As a medical researcher, I want to explore the associations between drug- target pairs within the AD network, so that I can better understand the mechanisms underlying Alzheimer's disease progression.",Medicine,,,,Sim,
A13US10O1,"As a biotech entrepreneur, I want to implement the AI-DrugNet framework in my startup, so that I can accelerate the discovery of innovative drug therapies for neurological and developmental disorders.",Biology,,,,Sim,
A14US1Ge,"As a taxi dispatcher, I want to use the system in real-time to identify areas with high demand for taxi services and dispatch vehicles accordingly.",Demography,,,,Sim,
A14US2Ge,"As a city planner, I want to use the system to analyze historical and predicted ridership data to optimize taxi stand locations and traffic flow management.",Movies,data summarization; ranking; representation learning,age; gender,"data summarization: age, gender | ranking: age, gender | representation learning: age, gender",Não,
A14US3Ge,"As a taxi company manager, I want the system to forecast future ridership trends to optimize fleet size and deployment strategies.",Computer Networks,,,,Sim,
A14US4Ge,"As a researcher, I want to access the system's data and models to understand the factors influencing spatiotemporal distribution of taxi and ride-hailing demand (e.g., time of day, borough, special events).",Biology,classification,,classification: —,Não,
A14US5Ge,"As a public transportation official, I want to compare predicted taxi and ride-hailing ridership with public transport usage to plan for integrated transportation solutions.",Health,classification,age; geography; sex; ethnicity; gender,"classification: age, geography, sex, ethnicity, gender",Não,
A14US6Ge,"As a policymaker, I want to use the system's data to assess the impact of ride-hailing services on traditional taxi ridership and develop regulations that ensure fair competition.",Finance & Marketing,anomaly detection,age; gender; race; sex,"anomaly detection: age, gender, race, sex",Não,
A14US7Ge,"As a data scientist, I want the system to allow for the integration of additional data sources (e.g., weather, special events) to potentially improve the accuracy of ridership predictions.",Health,classification; regression; representation learning,age; geography; sex; ethnicity; gender,"classification: age, geography, sex, ethnicity, gender | regression: age, ethnicity, gender, geography, sex | representation learning: age, ethnicity, gender, geography, sex",Não,
A14US8Ge,"As a consumer, I want to use a mobile app connected to the system to see estimated taxi and ride-hailing wait times in different areas before requesting a ride.",Movies,,,,Sim,
A14US9Ge,"As a taxi driver, I want the system to provide real-time information on areas with high predicted demand to maximize ridership and earnings.",Health,classification; graph diffusion; regression; representation learning,age; geography; sex; ethnicity; gender,"classification: age, geography, sex, ethnicity, gender | graph diffusion: age, ethnicity, gender, geography | regression: age, ethnicity, gender, geography, sex | representation learning: age, ethnicity, gender, geography, sex",Não,
A14US10Ge,"As a system developer, I want the system to be scalable and efficient to handle large volumes of real-time and historical data for accurate ridership prediction.",Law,classification; classification; ranking; regression; representation learning,age; geography; race; sex; ethnicity; gender,"classification: age, geography, race, sex, ethnicity, gender | ranking: age, gender, geography, race, sex | regression: age, ethnicity, gender, geography, race, sex | representation learning: age, ethnicity, gender, geography, race, sex",Não,
A14US1Ll,"As a city planner, I want to be able to visualize the spatiotemporal distribution of taxi and Uber pick-ups across the five boroughs of NYC, so that I can identify areas of high demand and optimize transportation infrastructure.",Movies,representation learning,age; gender,"representation learning: age, gender",Não,
A14US2Ll,"As a data analyst, I want to use machine learning algorithms such as XGboost and random forest to predict ridership of taxis and Uber combined in NYC, given a time window of one hour and location within zip-code areas, so that I can provide insights to stakeholders on transportation demand.",Biology,classification,,classification: —,Não,
A14US3Ll,"As a taxi company manager, I want to know the percentage of trips taken by each type of taxi (yellow, green, Uber) in each borough, so that I can optimize my fleet's distribution and services.",Computer Networks,,,,Sim,
A14US4Ll,"As a commuter, I want to be able to see the most popular transportation mode in each borough, so that I can plan my trips more effectively.",Plant Science,,,,Sim,
A14US5Ll,"As a city planner, I want to analyze the trend of Uber's growth in each borough, so that I can anticipate its impact on the transportation landscape and make informed decisions.",Movies,,,,Sim,
A14US6Ll,"As a data scientist, I want to use the XGboost model to estimate the total number of taxis needed to dispatch to meet demand, given a specific time window and location, so that I can provide actionable insights to taxi companies and city planners.",Health,classification,age; geography; sex; ethnicity; gender,"classification: age, geography, sex, ethnicity, gender",Não,
A14US7Ll,"As a decision- maker, I want to understand how ridership shifts over time in each borough, so that I can make informed decisions about transportation infrastructure and services.",Plant Science,,,,Sim,
A14US8Ll,"As a taxi company dispatcher, I want to know the optimal locations to situate taxis in each borough, so that I can minimize wait times and optimize my fleet's utilization.",Biology,,,,Sim,
A14US9Ll,"As a researcher, I want to analyze the dataset of over 90 million trips to identify patterns and trends in transportation behavior, so that I can provide insights to stakeholders on how to improve transportation services.",Biology,,,,Sim,
A14US10Ll,"As a city planner, I want to use the XGboost model to predict the impact of external factors (e.g. weather, events, road closures) on taxi and Uber ridership, so that I can develop strategies to mitigate their effects and ensure a smooth transportation system.",Movies,,,,Sim,
A14US1O1,"As a city planner, I want to use the XGBoost model to predict taxi and Uber ridership across NYC zip codes, so that I can optimize the placement of transportation resources.",Movies,,,,Sim,
A14US2O1,"As a transportation analyst, I want to analyze the spatiotemporal distribution of yellow, green, and Uber pickups, so that I can understand usage patterns across different boroughs.",Transportation,regression,geography; race,"regression: geography, race",Não,
A14US3O1,"As a taxi company manager, I want to leverage predictive insights from the XGBoost model, so that I can determine the optimal number of taxis to dispatch to meet demand.",Computer Networks,,,,Sim,
A14US4O1,"As a data scientist, I want to implement machine learning algorithms like XGBoost and random forest on the ridership dataset, so that I can accurately forecast transportation trends.",Health,classification; graph diffusion; pricing; regression; representation learning,age; geography; sex; ethnicity; gender,"classification: age, geography, sex, ethnicity, gender | graph diffusion: age, ethnicity, gender, geography | pricing: age, gender, geography | regression: age, ethnicity, gender, geography, sex | representation learning: age, ethnicity, gender, geography, sex",Não,
A14US5O1,"As a decision- maker, I want access to ridership predictions and trends, so that I can make informed policies to enhance transportation services in NYC.",Plant Science,,,,Sim,
A14US6O1,"As a Uber operations manager, I want to understand the rising trend of Uber pickups in Manhattan and outer boroughs, so that I can strategically expand our services.",Biology,classification,,classification: —,Não,
A14US7O1,"As a public transportation advocate, I want to visualize ridership shifts over time, so that I can advocate for balanced transportation options across all boroughs.",Social Networks,graph diffusion,age; ethnicity; gender; geography,"graph diffusion: age, ethnicity, gender, geography",Não,
A14US8O1,"As a urban economist, I want to study the dominance of yellow taxis in Manhattan and Queens versus green taxis in Brooklyn and the Bronx, so that I can analyze market preferences and economic factors.",Literature,,,,Sim,
A14US9O1,"As a software developer, I want to integrate the XGBoost model's predictions into a user-friendly dashboard, so that stakeholders can easily access and interpret the data.",Literature,,,,Sim,
A14US10O1,"As a researcher, I want to evaluate the performance of different regression models on the NYC ridership data, so that I can validate the effectiveness of XGBoost in capturing complex feature dependencies.",Biology,classification,,classification: —,Não,
A15US1Ge,"As a policymaker, I want to use machine learning to identify communities with high poverty rates so I can target resources and programs effectively.",Finance & Marketing,data summarization,age; gender; geography; race; sex,"data summarization: age, gender, geography, race, sex",Não,
A15US2Ge,"As a social worker, I want to use a tool that predicts income levels to help me assess the needs of my clients and connect them with appropriate support services.",Social Work,,,,Sim,
A15US3Ge,"As a financial advisor, I want to use machine learning models to personalize financial advice for my clients based on their predicted income and lifestyle.",Finance & Marketing,clustering; data summarization,age; gender; geography; race; sex,"clustering: age, gender, geography, race, sex | data summarization: age, gender, geography, race, sex",Não,
A15US4Ge,"As a researcher studying economic inequality, I want to use machine learning to analyze trends and patterns in income distribution across different demographics and regions.",Psychology,classification,age; geography; ethnicity; gender,"classification: age, geography, ethnicity, gender",Não,
A15US5Ge,"As a non-profit organization, I want to use income prediction models to identify potential donors and target fundraising campaigns more effectively.",Finance & Marketing,clustering; data summarization; representation learning,age; gender; geography; race; sex,"clustering: age, gender, geography, race, sex | data summarization: age, gender, geography, race, sex | representation learning: age, gender, geography, race, sex",Não,
A15US6Ge,"As a marketing professional, I want to use machine learning to segment my audience based on predicted income levels and tailor marketing messages accordingly.",Finance & Marketing,,,,Sim,
A15US7Ge,"As a credit risk analyst, I want to use machine learning models to assess the creditworthiness of loan applicants based on their predicted income and other relevant factors.",News,bias detection in word embeddings,textual references to people and their demographics,bias detection in word embeddings: textual references to people and their demographics,Não,
A15US8Ge,"As a human resources professional, I want to use machine learning to identify potential salary discrepancies within my organization and ensure fair compensation practices.",Health,,,,Sim,
A15US9Ge,"As a citizen concerned about income inequality, I want to see the results of machine learning models used to inform policy decisions and promote economic justice.",Biology,,,,Sim,
A15US10Ge,"As a data scientist, I want to develop and evaluate different machine learning algorithms for income forecasting, ensuring accuracy, fairness, and responsible use of data.",Library,,,,Sim,
A15US1Ll,"As a policymaker, I want to use machine learning technology to forecast income levels and identify areas of high poverty, so that I can develop targeted interventions to reduce economic inequality.",Finance & Marketing,anomaly detection; classification; classification; representation learning,age; gender; race; sex; geography,"anomaly detection: age, gender, race, sex | classification: age, geography, race, sex, gender | representation learning: age, gender, geography, race, sex",Não,
A15US2Ll,"As a researcher, I want to analyze the relationship between lifestyle factors and income levels using machine learning algorithms, so that I can better understand the root causes of poverty and inequality.",Medicine,classification; classification,age; race; sex; ethnicity; gender,"classification: age, race, sex, ethnicity, gender",Não,
A15US3Ll,"As a social worker, I want to use machine learning models to predict income levels and identify individuals who are at risk of poverty, so that I can provide targeted support and services.",Social Work,,,,Sim,
A15US4Ll,"As a data analyst, I want to develop machine learning models that can accurately predict annual income based on demographic and lifestyle factors, so that I can provide valuable insights to policymakers and researchers.",Biology,classification,,classification: —,Não,
A15US5Ll,"As a government official, I want to use machine learning technology to identify areas of high economic inequality and develop policies to address it, so that I can promote sustainable development and financial stability.",Social Media,classification,age; geography; race; disability; gender; textual references to people and their demographics; race/ethnicity; religion; sexual orientation,"classification: age, geography, race, disability, gender, textual references to people and their demographics, race/ethnicity, religion, sexual orientation",Não,
A15US6Ll,"As a non-profit organization, I want to use machine learning models to identify areas of high poverty and develop targeted interventions to reduce poverty and inequality.",Finance & Marketing,clustering,age; gender; geography; race; sex,"clustering: age, gender, geography, race, sex",Não,
A15US7Ll,"As a researcher, I want to explore the use of data mining strategies to analyze large datasets and identify patterns and relationships between variables that can inform income forecasting models.",Biology,classification; graph mining,,classification: — | graph mining: —,Não,
A15US8Ll,"As a policymaker, I want to use machine learning models to evaluate the effectiveness of poverty reduction programs and policies, so that I can make informed decisions about resource allocation.",Finance & Marketing,anomaly detection; classification; classification; representation learning,age; gender; race; sex; geography,"anomaly detection: age, gender, race, sex | classification: age, geography, race, sex, gender | representation learning: age, gender, geography, race, sex",Não,
A15US9Ll,"As a data scientist, I want to develop machine learning models that can handle large and complex datasets to predict income levels and identify areas of high poverty, so that I can provide accurate and reliable insights.",Health,classification; graph diffusion; pricing; regression; representation learning,age; geography; sex; ethnicity; gender,"classification: age, geography, sex, ethnicity, gender | graph diffusion: age, ethnicity, gender, geography | pricing: age, gender, geography | regression: age, ethnicity, gender, geography, sex | representation learning: age, ethnicity, gender, geography, sex",Não,
A15US10Ll,"As an economist, I want to use machine learning models to analyze the impact of economic policies on income inequality and poverty rates, so that I can inform evidence-based policy decisions.",Economics,,,,Sim,
A15US1O1,"As a government policy analyst, I want to use machine learning models to predict individuals' annual incomes based on their lifestyles, so that I can design targeted poverty reduction programs to address economic inequality.",Endocrinology,,,,Sim,
A15US2O1,"As a data scientist, I want to apply data mining strategies to analyze income distribution, so that I can identify key factors contributing to the wealth and income gap in the United States.",Health,classification; regression,age; geography; sex; ethnicity; gender,"classification: age, geography, sex, ethnicity, gender | regression: age, ethnicity, gender, geography, sex",Não,
A15US3O1,"As an economist, I want to forecast income trends using machine learning, so that I can assess the effectiveness of policies aimed at reducing economic inequality and poverty.",Economics,anomaly detection; classification; representation learning,age; gender; race; sex; geography; birthplace; disability; family size,"anomaly detection: age, gender, race, sex | classification: age, geography, race, sex, birthplace, disability, family size, gender | representation learning: age, gender, geography, race, sex",Não,
