id,User Story,refair_domain,refair_ml_tasks,refair_features,refair_features_por_task,ml_task_vazio,erro
A30US9Ge,"As a policymaker, I want to use data- driven insights to inform policies and programs aimed at reducing recidivism and promoting public safety.",Finance & Marketing,classification; classification,age; geography; race; sex; gender,"classification: age, geography, race, sex, gender",Não,
A30US10Ge,"As a citizen, I want to see a safer society where crime is prevented, and individuals are given the opportunity to successfully reintegrate into the community.",Music,,,,Sim,
A30US1Ll,"As a crime analyst, I want to understand the factors that influence the commission of repetitive crimes (recidivism) so that I can provide insights to law enforcement agencies to improve internal state security.",Literature,,,,Sim,
A30US2Ll,"As a law enforcement officer, I want to leverage artificial intelligence algorithms and blockchain technology to predict and prevent crimes, so that I can proactively address public safety concerns.",Health,representation learning,age; ethnicity; gender; geography; sex,"representation learning: age, ethnicity, gender, geography, sex",Não,
A30US3Ll,"As a data scientist, I want to develop machine-learning models that can identify individual characteristics of convicts that affect their propensity to commit criminal recidivism, so that I can help predict and prevent future crimes.",Health,classification; representation learning,age; geography; sex; ethnicity; gender,"classification: age, geography, sex, ethnicity, gender | representation learning: age, ethnicity, gender, geography, sex",Não,
A30US4Ll,"As a penitentiary institution administrator, I want a predictive model that can suggest the probability of repeated criminal offenses by convicts, so that I can tailor rehabilitation programs to reduce recidivism rates.",Sociology,,,,Sim,
A30US5Ll,"As a criminal justice decision- maker, I want a Decision Tree model that can classify convicts as prone or not prone to recidivism, so that I can make informed decisions about parole, probation, and sentencing.",Biology,classification,,classification: —,Não,
A30US6Ll,"As a researcher, I want to analyze the factors that determine the propensity of convicts to commit criminal recidivism, so that I can identify the most important variables to focus on in predictive criminology.",Biology,classification,,classification: —,Não,
A30US7Ll,"As a law enforcement agency, I want to use predictive analytics to identify high-risk individuals and allocate resources more effectively, so that I can prevent crimes and improve public safety.",Biology,graph mining,,graph mining: —,Não,
A30US8Ll,"As a technology developer, I want to explore the possibility of using distributed registers/blockchain technology in predictive criminology, so that I can improve the accuracy and transparency of crime prediction models.",Biology,classification,,classification: —,Não,
A30US9Ll,"As a crime prevention specialist, I want to use machine- learning models to identify patterns and trends in criminal behavior, so that I can develop targeted crime prevention strategies to reduce recidivism rates.",Biology,classification,,classification: —,Não,
A30US10Ll,"As a government official, I want to leverage predictive analytics and blockchain technology to improve the efficiency and effectiveness of the criminal justice system, so that I can make data- driven decisions to enhance public safety and reduce crime rates.",Social Media,,,,Sim,
A30US1O1,"As a law enforcement officer, I want to use machine learning models to predict the likelihood of criminal recidivism, so that I can implement targeted interventions to prevent repeat offenses.",Biology,classification; graph mining,,classification: — | graph mining: —,Não,
A30US2O1,"As a data scientist, I want to develop and refine Decision Tree models using convict data, so that I can accurately identify key factors influencing recidivism rates.",Biology,,,,Sim,
A30US3O1,"As a correctional facility administrator, I want to leverage predictive models to assess the risk of inmates committing future crimes, so that I can tailor rehabilitation programs accordingly.",Biology,classification,,classification: —,Não,
A30US4O1,"As a policymaker, I want insights from recidivism prediction models, so that I can formulate effective criminal justice policies aimed at reducing repeat offenses.",Finance & Marketing,anomaly detection; classification; classification; representation learning,age; gender; race; sex; geography,"anomaly detection: age, gender, race, sex | classification: age, geography, race, sex, gender | representation learning: age, gender, geography, race, sex",Não,
A30US5O1,"As a criminal justice researcher, I want to analyze the main factors affecting recidivism, so that I can contribute to the development of evidence-based strategies for crime prevention.",Literature,,,,Sim,
A30US6O1,"As a blockchain developer, I want to explore the integration of distributed ledger technology in predictive criminology, so that I can enhance the transparency and security of recidivism data.",Biology,classification,,classification: —,Não,
A30US7O1,"As a probation officer, I want access to predictive tools that identify high-risk individuals, so that I can prioritize monitoring and support for those most likely to reoffend.",Biology,classification,,classification: —,Não,
A30US8O1,"As an IT specialist in a penitentiary institution, I want to implement Decision Tree models within our information systems, so that staff can easily access recidivism risk assessments for decision-making support.",Information Systems,,,,Sim,
A30US9O1,"As a public safety advocate, I want to understand the factors that contribute to recidivism, so that I can promote community programs that address these underlying issues.",Biology,,,,Sim,
A30US10O1,"As a legal advisor, I want to utilize predictive models to assess the risk of recidivism for clients, so that I can provide informed recommendations during parole hearings and sentencing.",Law,classification; classification; ranking; regression; representation learning; risk assessment; task assignment,age; geography; race; sex; ethnicity; gender,"classification: age, geography, race, sex, ethnicity, gender | ranking: age, gender, geography, race, sex | regression: age, ethnicity, gender, geography, race, sex | representation learning: age, ethnicity, gender, geography, race, sex | risk assessment: age, ethnicity, gender, geography, race | task assignment: age, geography, sex",Não,
A31US1Ge,"As a web developer, I want to build a browser extension that can highlight and block advertisements on websites, improving the user experience and reducing distractions.",Literature,clustering,author; gender; textual references to people and their demographics,"clustering: author, gender, textual references to people and their demographics",Não,
A31US2Ge,"As a content creator, I want to be able to identify and differentiate advertisements on my website to ensure transparency and avoid misleading my audience.",Literature,,,,Sim,
A31US3Ge,"As a cybersecurity researcher, I want to analyze the features of online advertisements to develop tools for detecting malicious or misleading ads that could be used for phishing or other attacks.",Biology,classification,,classification: —,Não,
A31US4Ge,"As a parent, I want to use tools to control the type of advertisements my children see online, protecting them from inappropriate content and promoting responsible internet use.",Psychology,classification,age; geography; ethnicity; gender,"classification: age, geography, ethnicity, gender",Não,
A31US5Ge,"As a search engine developer, I want to improve the accuracy of search results by identifying and filtering out advertisements, ensuring that users find the information they are looking for more easily.",Biology,,,,Sim,
A31US6Ge,"As a web accessibility advocate, I want to ensure that online advertisements are accessible to users with disabilities, providing a more inclusive browsing experience for everyone.",Literature,clustering; ranking,author; gender; textual references to people and their demographics,"clustering: author, gender, textual references to people and their demographics | ranking: gender",Não,
A31US7Ge,"As a marketing professional, I want to analyze the effectiveness of online advertising campaigns by tracking user interactions with identified advertisements.",Finance & Marketing,anomaly detection; classification; classification; data summarization; ranking; representation learning; resource allocation,age; gender; race; sex; geography; activity,"anomaly detection: age, gender, race, sex | classification: age, geography, race, sex, gender | data summarization: age, gender, geography, race, sex | ranking: activity, age, gender, geography, race, sex | representation learning: age, gender, geography, race, sex | resource allocation: age, race, sex, geography",Não,
A31US8Ge,"As a privacy advocate, I want to understand how online advertisements track user behavior and be able to control the data collected about me for advertising purposes.",Medicine,classification; classification,age; race; sex; ethnicity; gender,"classification: age, race, sex, ethnicity, gender",Não,
A31US9Ge,"As a consumer, I want to be able to make informed decisions about the products and services advertised online by readily identifying them and understanding their purpose.",Music,ranking,gender; geography,"ranking: gender, geography",Não,
A31US10Ge,"As a web user, I want to have a clean and clutter- free browsing experience where I can focus on the content I am interested in without being bombarded by intrusive advertisements.",Literature,,,,Sim,
A31US1Ll,"As a user, I want to be able to easily identify advertisements on internet pages, so that I can avoid unnecessary distractions and stay focused on finding relevant information.",Transportation,,,,Sim,
A31US2Ll,"As a researcher, I want to develop an approach to differentiate advertisements on internet pages, so that I can improve the overall quality of online experiences.",Medicine,classification; classification,age; race; sex; ethnicity; gender,"classification: age, race, sex, ethnicity, gender",Não,
A31US3Ll,"As a developer, I want to create a system that can predict the presence of advertisements on internet pages, so that I can help users avoid unwanted content.",Medicine,classification; classification,age; race; sex; ethnicity; gender,"classification: age, race, sex, ethnicity, gender",Não,
A31US4Ll,"As a parent, I want to be able to block advertisements on internet pages that are not suitable for my children, so that I can ensure their online safety.",Music,,,,Sim,
A31US5Ll,"As a search engine developer, I want to be able to identify and filter out advertisements from search results, so that users can get more relevant and accurate results.",Biology,,,,Sim,
A31US6Ll,"As an educator, I want to be able to distinguish between educational content and advertisements on internet pages, so that I can provide more effective online learning experiences.",Education,data summarization,age; caste; gender; geography; race; sex,"data summarization: age, caste, gender, geography, race, sex",Não,
A31US7Ll,"As a security expert, I want to be able to detect and prevent malicious advertisements on internet pages, so that I can protect users from online threats.",Finance & Marketing,advertising; anomaly detection; classification; classification; clustering; data summarization; pricing; ranking; representation learning,gender; geography; race; age; sex; activity,"advertising: gender, geography, race | anomaly detection: age, gender, race, sex | classification: age, geography, race, sex, gender | clustering: age, gender, geography, race, sex | data summarization: age, gender, geography, race, sex | pricing: age, gender, geography | ranking: activity, age, gender, geography, race, sex | representation learning: age, gender, geography, race, sex",Não,
A31US8Ll,"As a user, I want to have control over the types of advertisements I see on internet pages, so that I can personalize my online experience.",Transportation,,,,Sim,
A31US9Ll,"As a researcher, I want to explore the use of machine learning algorithms to identify and classify advertisements on internet pages, so that I can improve the accuracy and efficiency of advertisement detection.",Biology,classification,,classification: —,Não,
A31US10Ll,"As a developer, I want to create a browser extension or plugin that can automatically identify and block advertisements on internet pages, so that users can have a more seamless and enjoyable online experience.",Medicine,,,,Sim,
A31US1O1,"As a search engine developer, I want to implement advertisement identification algorithms, so that we can deliver cleaner and more relevant search results to users.",Literature,clustering,author; gender; textual references to people and their demographics,"clustering: author, gender, textual references to people and their demographics",Não,
A31US2O1,"As an internet security specialist, I want to deploy ad detection methods, so that we can protect users from malicious advertisements and enhance overall online safety.",Urban Studies,,,,Sim,
A31US3O1,"As a web browser developer, I want to integrate ad identification features, so that users can easily manage and block unwanted advertisements while browsing.",Literature,clustering; ranking,author; gender; textual references to people and their demographics,"clustering: author, gender, textual references to people and their demographics | ranking: gender",Não,
A31US4O1,"As an educator, I want to use ad detection tools in my curriculum, so that students can learn about internet safety and the impact of advertisements on web content.",Education,,,,Sim,
A31US5O1,"As a digital marketer, I want to understand how advertisements are identified on web pages, so that I can optimize ad placements and improve campaign effectiveness.",Computer Networks,,,,Sim,
A31US6O1,"As a privacy advocate, I want to utilize advertisement identification techniques, so that I can help users reduce unwanted tracking and protect their online privacy.",Medicine,,,,Sim,
A31US7O1,"As a data scientist, I want to analyze and refine ad prediction approaches, so that I can develop more accurate and efficient methods for identifying advertisements on web pages.",Health,,,,Sim,
A31US8O1,"As a content creator, I want to identify and manage advertisements on my website, so that I can maintain control over my content and revenue streams.",Literature,,,,Sim,
A31US9O1,"As a product manager for a security software company, I want to incorporate ad identification features into our products, so that we can offer comprehensive protection against unwanted advertisements and malware.",Biology,classification; graph mining,,classification: — | graph mining: —,Não,
A31US10O1,"As a researcher in web technologies, I want to evaluate the effectiveness of different ad prediction methods, so that I can contribute to the advancement of advertisement filtering systems.",Health,classification; representation learning,age; geography; sex; ethnicity; gender,"classification: age, geography, sex, ethnicity, gender | representation learning: age, ethnicity, gender, geography, sex",Não,
A32US1Ge,"As a social media researcher, I want to analyze large datasets of social media posts to understand public opinion on current events or political issues.",Social Media,bias detection in language models; bias detection in word embeddings; sentiment analysis; speech recognition,gender; political leaning; race; religion; textual references to people and their demographics; age; geography,"bias detection in language models: gender, political leaning, race, religion, textual references to people and their demographics, age, geography | bias detection in word embeddings: race, gender, textual references to people and their demographics | sentiment analysis: race | speech recognition: gender, geography",Não,
A32US2Ge,"As a brand manager, I want to use the system to identify user comments expressing positive, negative, or neutral stances towards my brand.",Literature,clustering,author; gender; textual references to people and their demographics,"clustering: author, gender, textual references to people and their demographics",Não,
A32US3Ge,"As a journalist, I want the system to help me verify the credibility of sources and identify potential bias in news articles and online content.",News,,,,Sim,
A32US4Ge,"As a fact-checker, I want the system to flag social media posts containing misinformation or disinformation based on the stance taken towards a particular claim.",Health,classification,age; geography; sex; ethnicity; gender,"classification: age, geography, sex, ethnicity, gender",Não,
A32US5Ge,"As a social media moderator, I want to prioritize content for review based on the intensity of a user's stance (e.g., strongly against vs. mildly disagreeing).",Social Media,classification; sentiment analysis,age; geography; race; disability; gender; textual references to people and their demographics; race/ethnicity; religion; sexual orientation,"classification: age, geography, race, disability, gender, textual references to people and their demographics, race/ethnicity, religion, sexual orientation | sentiment analysis: race",Não,
A32US6Ge,"As a platform developer, I want the system to integrate with social media platforms to automatically detect and label the stance of user comments on specific topics.",Literature,clustering; ranking,author; gender; textual references to people and their demographics,"clustering: author, gender, textual references to people and their demographics | ranking: gender",Não,
A32US7Ge,"As a data scientist, I want the system to provide not just the overall stance, but also detailed information like confidence scores and sentiment analysis for a more nuanced understanding.",Health,classification; regression; representation learning,age; geography; sex; ethnicity; gender,"classification: age, geography, sex, ethnicity, gender | regression: age, ethnicity, gender, geography, sex | representation learning: age, ethnicity, gender, geography, sex",Não,
A32US8Ge,"As a linguist, I want the system to be customizable to analyze stances in different languages and cultural contexts, accounting for sarcasm and humor.",Linguistics,sentiment analysis; sentiment analysis; sentiment analysis,race; sex,"sentiment analysis: race, sex",Não,
A32US9Ge,"As a user privacy advocate, I want the system to be transparent about how user data is used for stance detection and ensure user privacy is protected.",Transportation,,,,Sim,
A32US10Ge,"As a system developer, I want the system to be scalable and efficient to handle large volumes of social media data in real-time.",Law,classification; classification; regression; representation learning,age; geography; race; sex; ethnicity; gender,"classification: age, geography, race, sex, ethnicity, gender | regression: age, ethnicity, gender, geography, race, sex | representation learning: age, ethnicity, gender, geography, race, sex",Não,
A32US1Ll,"As a social media analyst, I want to automatically analyze opinions and attitudes expressed in text on social media platforms so that I can quickly identify trends and sentiments.",Social Media,bias detection in language models; bias detection in word embeddings; classification; ranking; sentiment analysis; speech recognition,gender; political leaning; race; religion; textual references to people and their demographics; age; geography; disability; race/ethnicity; sexual orientation,"bias detection in language models: gender, political leaning, race, religion, textual references to people and their demographics, age, geography | bias detection in word embeddings: race, gender, textual references to people and their demographics | classification: age, geography, race, disability, gender, textual references to people and their demographics, race/ethnicity, religion, sexual orientation | ranking: age, gender, geography, race | sentiment analysis: race | speech recognition: gender, geography",Não,
A32US2Ll,"As a researcher, I want to develop an automated tool for stance detection that can accurately identify the underlying perspective or viewpoint of an individual or group towards a specific topic or target.",Biology,,,,Sim,
A32US3Ll,"As a software engineer, I want to design a system that can classify the stance or viewpoint of a text towards a target, even when the target is of an abstract nature, so that I can improve the accuracy of opinion analysis.",Literature,,,,Sim,
A32US4Ll,"As a data analyst, I want to integrate sentiment analysis and sarcasm detection tasks into a multi-task learning (MTL) model to enhance stance detection performance so that I can better understand the nuances of human opinions.",Sport,,,,Sim,
A32US5Ll,"As a product manager, I want to develop a system that can handle the challenges of stance detection in social media, where brevity, informality, and limited contextual information prevail, so that I can provide accurate insights to businesses and organizations.",Literature,,,,Sim,
A32US6Ll,"As a researcher, I want to propose and evaluate four task weighting techniques for MTL models to determine their effectiveness in enhancing stance detection performance so that I can improve the accuracy of opinion analysis.",Biology,classification,,classification: —,Não,
A32US7Ll,"As a software engineer, I want to design an MTL model that can achieve state-of- the-art performance in stance detection, using a hierarchical weighting approach, so that I can provide a robust solution for opinion analysis.",Literature,ranking,gender,ranking: gender,Não,
A32US8Ll,"As a data analyst, I want to evaluate the performance of the proposed MTL models on English and Arabic benchmark datasets to determine their effectiveness in stance detection so that I can identify the best approach for opinion analysis.",Biology,classification,,classification: —,Não,
A32US9Ll,"As a researcher, I want to investigate the interaction between sentiment and stance, while considering the impact of sarcasm, so that I can gain a deeper understanding of human opinions and attitudes.",Biology,classification,,classification: —,Não,
A32US10Ll,"As a product manager, I want to develop a commercial application that utilizes the proposed MTL models for stance detection, providing businesses and organizations with accurate insights into public opinions and sentiments.",Literature,,,,Sim,
A32US1O1,"As an NLP researcher, I want to develop multi- task learning models that integrate sentiment analysis and sarcasm detection, so that I can enhance the accuracy of stance detection in text analysis.",Biology,,,,Sim,
A32US2O1,"As a data scientist, I want to implement Parallel Multi-Task Learning (PMTL) and Sequential Multi-Task Learning (SMTL) models, so that I can improve the performance of stance detection algorithms on social media data.",Health,classification; representation learning,age; geography; sex; ethnicity; gender,"classification: age, geography, sex, ethnicity, gender | representation learning: age, ethnicity, gender, geography, sex",Não,
A32US3O1,"As a social media analyst, I want automated stance detection tools that account for brevity and informality, so that I can accurately gauge public opinions and attitudes toward specific topics.",Social Media,,,,Sim,
A32US4O1,"As a product manager for an opinion analysis platform, I want to incorporate Transformer-based architectures with multi-task learning, so that our tool can provide state-of- the-art stance detection capabilities to users.",Biology,classification; graph mining,,classification: — | graph mining: —,Não,
A32US5O1,"As a machine learning engineer, I want to explore and apply different task weighting techniques in multi- task learning models, so that I can optimize the integration of sentiment, stance, and sarcasm detection tasks for better performance.",Computer Networks,clustering,,clustering: —,Não,
A32US6O1,"As an academic instructor, I want to use the SMTL-HW model as a case study in my Natural Language Processing course, so that students can learn about the advancements in multi-task learning for stance detection.",Education,classification; regression,age; geography; race; sex; ethnicity; family wealth; gender; financial status,"classification: age, geography, race, sex, ethnicity, family wealth, gender | regression: age, ethnicity, financial status, gender, geography, race, sex",Não,
A32US7O1,"As a software developer, I want to implement an accessible architecture for multi-task learning models, so that my team can efficiently deploy stance detection systems in real-world applications.",Literature,clustering,author; gender; textual references to people and their demographics,"clustering: author, gender, textual references to people and their demographics",Não,
A32US8O1,"As a linguist, I want to analyze the interaction between sentiment, stance, and sarcasm in text, so that I can better understand the nuances of human communication in digital environments.",Linguistics,entity resolution; sentiment analysis; sentiment analysis; sentiment analysis,business size; geography; race; sex,"entity resolution: business size, geography | sentiment analysis: race, sex",Não,
