id,User Story,refair_domain,refair_ml_tasks,refair_features,refair_features_por_task,ml_task_vazio,erro
A21US3Ll,"As an analyst, I want to examine the correlation between perceived gender and race with worker evaluations on TaskRabbit and Fiverr so that I can identify potential biases.",Economics,anomaly detection; classification; representation learning,age; gender; race; sex; geography; birthplace; disability; family size,"anomaly detection: age, gender, race, sex | classification: age, geography, race, sex, birthplace, disability, family size, gender | representation learning: age, gender, geography, race, sex",Não,
A21US4Ll,"As a researcher, I want to investigate the potential harm that biased evaluations can cause to workers' employment opportunities on online freelancing marketplaces.",Medicine,,,,Sim,
A21US5Ll,"As a platform administrator, I want to ensure that my online freelancing marketplace is free from racial and gender bias so that all workers have equal opportunities.Justice/fairness",Literature,,,,Sim,
A21US6Ll,"As a freelancer, I want to be evaluated based on my skills and performance, rather than my gender or race, so that I can compete fairly on online freelancing marketplaces.",Biology,,,,Sim,
A21US7Ll,"As a researcher, I want to compare the levels of bias on different online freelancing marketplaces, such as TaskRabbit and Fiverr, so that I can understand the variations in bias across platforms.",Biology,classification; graph mining,,classification: — | graph mining: —,Não,
A21US8Ll,"As a policy maker, I want to develop policies to mitigate the effects of racial and gender bias on online freelancing marketplaces so that workers are protected from discrimination.",Finance & Marketing,anomaly detection; classification; classification,age; gender; race; sex; geography,"anomaly detection: age, gender, race, sex | classification: age, geography, race, sex, gender",Não,
A21US9Ll,"As a freelancer, I want to be able to report instances of bias or discrimination on online freelancing marketplaces so that action can be taken to address them.",Biology,classification,,classification: —,Não,
A21US10Ll,"As a researcher, I want to explore the broader implications of discrimination on online environments and the potential consequences for workers and society as a whole.",Medicine,classification; classification,age; race; sex; ethnicity; gender,"classification: age, race, sex, ethnicity, gender",Não,
A21US1O1,"As an online marketplace manager, I want to analyze racial and gender biases in worker evaluations on TaskRabbit and Fiverr, so that I can implement policies to promote fair employment practices.",Urban Studies,,,,Sim,
A21US2O1,"As a freelancer, I want assurance that my gender and race do not negatively impact my customer reviews and search rankings, so that I have equal opportunities to succeed on the platform.",Biology,,,,Sim,
A21US3O1,"As a data scientist, I want to examine the correlation between worker demographics and customer ratings, so that I can identify and address potential biases in the evaluation system.",Biology,,,,Sim,
A21US4O1,"As a policy maker, I want to understand the extent of discrimination in online freelancing marketplaces, so that I can develop regulations to ensure equitable treatment of all workers.",Finance & Marketing,anomaly detection; classification; classification; clustering; representation learning,age; gender; race; sex; geography,"anomaly detection: age, gender, race, sex | classification: age, geography, race, sex, gender | clustering: age, gender, geography, race, sex | representation learning: age, gender, geography, race, sex",Não,
A21US5O1,"As a diversity and inclusion officer, I want tools to monitor and mitigate bias in worker evaluations, so that the platform fosters an inclusive and fair environment for all users.",Biology,classification; graph mining,,classification: — | graph mining: —,Não,
A21US6O1,"As a customer support manager, I want to train support staff to recognize and address biased customer reviews, so that workers are treated fairly and discrimination is minimized.",Computer Networks,,,,Sim,
A21US7O1,"As a user experience designer, I want to redesign search ranking algorithms to reduce bias based on gender and race, so that all workers have an equal chance of being discovered by clients.",Transportation,regression,geography; race,"regression: geography, race",Não,
A21US8O1,"As an anti- discrimination advocate, I want to highlight findings of bias in online freelance marketplaces, so that awareness is raised and corrective actions are encouraged.",Law,classification; classification,age; geography; race; sex; ethnicity; gender,"classification: age, geography, race, sex, ethnicity, gender",Não,
A21US9O1,"As an academic researcher, I want access to anonymized worker and review data from TaskRabbit and Fiverr, so that I can conduct studies on discrimination in digital economies.",Education,data summarization; representation learning,age; caste; gender; geography; race; sex; ethnicity; financial status,"data summarization: age, caste, gender, geography, race, sex | representation learning: age, ethnicity, financial status, gender, geography, race, sex",Não,
A21US10O1,"As an HR manager for a freelancing platform, I want to implement bias detection and correction mechanisms in worker evaluations, so that our platform supports equal opportunity and fairness for all users.",Biology,,,,Sim,
A22US1Ge,"As a client on an online labor marketplace, I want to find the best freelancer for my job, but sifting through hundreds of applicants with inflated ratings is overwhelming.",Biology,classification,,classification: —,Não,
A22US2Ge,"As a freelancer on an online labor marketplace, I want a fair and accurate assessment of my skills and experience, not just based on unreliable ratings.",Biology,,,,Sim,
A22US3Ge,"As a developer of an online labor marketplace, I want a system that helps clients hire the right freelancers for their jobs, leading to better project outcomes and increased platform satisfaction.",Biology,,,,Sim,
A22US4Ge,"As a data scientist, I want to explore ways to improve the accuracy and fairness of freelancer assessment on online platforms.",Health,classification,age; geography; sex; ethnicity; gender,"classification: age, geography, sex, ethnicity, gender",Não,
A22US5Ge,"As a researcher studying online labor markets, I want to understand how different factors, such as past job performance and skills, influence the success of freelancers.",Biology,graph mining,,graph mining: —,Não,
A22US6Ge,"As a platform user safety advocate, I want to ensure that the assessment framework is transparent and unbiased, preventing discrimination against any freelancer.",Finance & Marketing,anomaly detection,age; gender; race; sex,"anomaly detection: age, gender, race, sex",Não,
A22US7Ge,"As a freelancer with limited work history, I want the assessment framework to consider my potential and ability to learn, not just my past experience.",Biology,,,,Sim,
A22US8Ge,"As a client with a specific project requirement, I want the assessment framework to prioritize freelancers with relevant skills and experience for my job.",Biology,classification,,classification: —,Não,
A22US9Ge,"As a policymaker, I want to consider the implications of using data-driven assessment frameworks for online labor, ensuring ethical practices and fair competition.",Finance & Marketing,,,,Sim,
A22US10Ge,"As a global citizen, I want to see online labor platforms promote a fair and meritocratic system for connecting clients with skilled freelancers, contributing to a thriving gig economy.",Law,,,,Sim,
A22US1Ll,"As a client, I want to be able to hire the best freelancer for a job on an online labor marketplace so that I can ensure high- quality work.",Music,ranking,gender; geography,"ranking: gender, geography",Não,
A22US2Ll,"As a client, I want to have an effective way to filter through the large number of freelancers applying for a posted job so that I can efficiently identify the most suitable candidate.",Music,,,,Sim,
A22US3Ll,"As a freelancer, I want my abilities and skills to be accurately assessed so that I can increase my chances of being hired for jobs that match my expertise.",Biology,classification,,classification: —,Não,
A22US4Ll,"As a client, I want to be able to trust the ratings of freelancers on an online labor marketplace so that I can make informed hiring decisions.",Music,,,,Sim,
A22US5Ll,"As a system administrator, I want to improve the accuracy of freelancer ratings so that clients can make better hiring decisions.",Information Systems,subset selection,age; gender; geography; race,"subset selection: age, gender, geography, race",Não,
A22US6Ll,"As a researcher, I want to develop a multidimensional assessment framework that evaluates freelancers on several dimensions so that clients can get a more comprehensive view of a freelancer's abilities.",Biology,classification,,classification: —,Não,
A22US7Ll,"As a client, I want the assessment framework to not only use current information about the freelancer but also utilize their past job performance so that I can get a more accurate picture of their abilities.",Biology,classification,,classification: —,Não,
A22US8Ll,"As a system administrator, I want to evaluate the proposed framework on a large dataset of jobs and applicants so that I can determine its effectiveness in improving hiring decisions.",Biology,classification,,classification: —,Não,
A22US9Ll,"As a researcher, I want to compare the performance of the proposed framework with a baseline algorithm so that I can quantify the improvement in hiring decisions.",Psychology,classification,age; geography; ethnicity; gender,"classification: age, geography, ethnicity, gender",Não,
A22US10Ll,"As a client, I want to have access to a user-friendly interface that provides a comprehensive assessment of freelancers based on the proposed framework so that I can make informed hiring decisions with ease.",Biology,classification,,classification: —,Não,
A22US1O1,"As a client on an online marketplace, I want a multidimensional assessment framework to evaluate freelancers, so that I can make more informed hiring decisions beyond biased ratings.",Biology,classification,,classification: —,Não,
A22US2O1,"As a freelance worker, I want my past job performances to be considered in my evaluations, so that my true abilities and work quality are accurately reflected to potential clients.",Biology,classification; graph mining,,classification: — | graph mining: —,Não,
A22US3O1,"As a platform manager, I want to implement a comprehensive assessment system, so that the hiring process becomes more efficient and trustworthy for both clients and freelancers.",Literature,,,,Sim,
A22US4O1,"As a data scientist, I want to analyze large datasets of job applications and outcomes, so that I can refine the multidimensional assessment framework to better predict freelancer performance.",Biology,classification,,classification: —,Não,
A22US5O1,"As a hiring manager, I want detailed insights into multiple dimensions of a freelancer’s capabilities, so that I can select the most suitable candidate for each specific job requirement.",Biology,,,,Sim,
A22US6O1,"As a quality assurance specialist, I want the assessment framework to outperform baseline algorithms, so that I can ensure the platform consistently provides high- quality freelancer evaluations.",Biology,classification,,classification: —,Não,
A22US7O1,"As a freelancer, I want a fair and transparent evaluation system, so that my chances of being hired are based on my actual skills and past performance rather than inflated ratings.",Biology,,,,Sim,
A22US8O1,"As a marketing manager for the platform, I want to promote the new assessment framework, so that we can attract both high-quality freelancers and discerning clients seeking reliable hiring tools.",Biology,,,,Sim,
A22US9O1,"As a user experience designer, I want to create an intuitive interface for the assessment framework, so that clients can easily understand and utilize the multidimensional evaluations during their hiring process.",Transportation,graph augmentation; matching; pricing; regression,race; geography,"graph augmentation: race | matching: geography, race | pricing: geography | regression: geography, race",Não,
A22US10O1,"As an academic researcher, I want access to the assessment framework’s evaluation data, so that I can study its effectiveness in improving hiring outcomes in online labor marketplaces.",Education,classification; representation learning,age; geography; race; sex; ethnicity; family wealth; gender; financial status,"classification: age, geography, race, sex, ethnicity, family wealth, gender | representation learning: age, ethnicity, financial status, gender, geography, race, sex",Não,
A23US1Ge,"As a researcher studying search engine algorithms, I want to understand how different search engines prioritize and rank content, including potential biases and favoritism.",Biology,,,,Sim,
A23US2Ge,"As a journalist or media analyst, I want to compare and contrast the results of different search engines to ensure I'm getting a comprehensive and diverse perspective on a topic.",News,,,,Sim,
A23US3Ge,"As a developer of search engine optimization (SEO) tools, I want to analyze how different search engines prioritize different types of content and adjust my strategies accordingly.",Biology,graph mining,,graph mining: —,Não,
A23US4Ge,"As a policymaker concerned with online information access, I want to monitor potential biases and manipulation within search engine algorithms and ensure fair and transparent access to information.",Biology,,,,Sim,
A23US5Ge,"As a consumer of online information, I want to be aware of how search engines might influence the information I see and be able to make informed choices about which sources to trust.",Biology,,,,Sim,
A23US6Ge,"As a developer of educational tools, I want to integrate PAWS into my resources to teach students about the potential biases and limitations of search engines.",Biology,classification,,classification: —,Não,
A23US7Ge,"As a librarian or information professional, I want to use PAWS to understand the strengths and weaknesses of different search engines and guide my users towards reliable and diverse information sources.",Library,,,,Sim,
A23US8Ge,"As a developer of metasearch engines, I want to use PAWS to aggregate results from different search engines while providing users with transparency about potential biases and emphasis.",Biology,graph mining,,graph mining: —,Não,
A23US9Ge,"As a data scientist, I want to explore new ways to analyze and visualize the differences between search engine results, including using machine learning and natural language processing techniques.",Health,classification; graph diffusion; matching; pricing; regression; representation learning,age; geography; sex; ethnicity; gender,"classification: age, geography, sex, ethnicity, gender | graph diffusion: age, ethnicity, gender, geography | matching: age, gender, geography | pricing: age, gender, geography | regression: age, ethnicity, gender, geography, sex | representation learning: age, ethnicity, gender, geography, sex",Não,
A23US10Ge,"As a global citizen, I want to see a more transparent and balanced online information landscape where users can access diverse perspectives and make informed decisions about the information they consume.",Literature,,,,Sim,
A23US1Ll,"As a researcher, I want to study how search engine algorithms affect the content users see so that I can understand potential biases.",Medicine,,,,Sim,
A23US2Ll,"As a web developer, I want to create a platform (PAWS) to analyze differences in search engine rankings so that I can help users understand these variations.",Literature,ranking,gender,ranking: gender,Não,
A23US3Ll,"As a user, I want to know when different search engines favor certain sites or points of view so that I can make informed decisions about the information I consume.",Transportation,,,,Sim,
A23US4Ll,"As a developer, I want to integrate the PAWS platform into search engines to enhance transparency and user trust.",Movies,,,,Sim,
A23US5Ll,"As a researcher, I want to develop techniques to identify the orientation of search results at scale so that I can improve the efficiency of content analysis.",Medicine,classification; classification,age; race; sex; ethnicity; gender,"classification: age, race, sex, ethnicity, gender",Não,
A23US6Ll,"As a user, I want to know if search engines prioritize results that favor their company's products so that I can be aware of potential conflicts of interest.",Transportation,,,,Sim,
A23US7Ll,"As a developer, I want to apply the PAWS platform to analyze news search results on Google and Bing so that I can identify any biases or preferences.",Medicine,,,,Sim,
A23US8Ll,"As a researcher, I want to understand how search engines rank content with advertisements so that I can study their impact on user behavior.",Medicine,,,,Sim,
A23US9Ll,"As a web developer, I want to ensure the PAWS platform can identify and minimize biases in search engine rankings so that users can access more balanced information.",Literature,,,,Sim,
A23US10Ll,"As a researcher, I want to collaborate with other experts to refine the PAWS platform and advance the understanding of search engine biases and content emphasis.",Medicine,,,,Sim,
A23US1O1,"As a web user, I want to understand how different search engines prioritize content, so that I can make informed decisions about which results to trust and explore.Transparency",Literature,clustering,author; gender; textual references to people and their demographics,"clustering: author, gender, textual references to people and their demographics",Não,
A23US2O1,"As a transparency advocate, I want to use the PAWS platform to analyze search engine biases, so that I can promote fair and unbiased access to web information.",Biology,classification,,classification: —,Não,
A23US3O1,"As a data scientist, I want to leverage PAWS to measure content emphasis across search engines, so that I can study the correlation between search rankings and content features.",Sport,,,,Sim,
A23US4O1,"As a journalist, I want to identify if search engines favor certain news sites or viewpoints, so that I can report on potential biases in information dissemination.",News,,,,Sim,
A23US5O1,"As a search engine developer, I want to utilize insights from PAWS, so that I can improve our ranking algorithms to ensure balanced and fair search results.",Literature,,,,Sim,
A23US6O1,"As a policy maker, I want to understand the influence of search engine rankings on public opinion, so that I can develop regulations that promote transparency and fairness.",Finance & Marketing,,,,Sim,
A23US7O1,"As a marketing analyst, I want to determine if search engines prioritize pages with our advertisements, so that I can optimize our advertising strategies accordingly.",Finance & Marketing,data summarization,age; gender; geography; race; sex,"data summarization: age, gender, geography, race, sex",Não,
A23US8O1,"As an academic researcher, I want to apply PAWS to various search engines, so that I can conduct comprehensive studies on search engine behavior and content emphasis.",Education,data summarization,age; caste; gender; geography; race; sex,"data summarization: age, caste, gender, geography, race, sex",Não,
A23US9O1,"As a competitor in the search engine market, I want to analyze how our ranking algorithms compare to others using PAWS, so that I can identify areas for improvement and differentiation.",Biology,,,,Sim,
A23US10O1,"As a privacy- conscious user, I want to be informed when search engines favor certain points of view or advertisements, so that I can seek a more balanced perspective in my searches.",Biology,,,,Sim,
A24US1Ge,"As a researcher, I want to easily discover other researchers with expertise in my field, allowing me to connect and collaborate on projects.",Medicine,classification; classification,age; race; sex; ethnicity; gender,"classification: age, race, sex, ethnicity, gender",Não,
A24US2Ge,"As a research administrator, I want to efficiently identify potential reviewers for manuscripts based on their expertise and publication history.",Information Systems,data summarization,age; gender; geography; race; sex; skin tone,"data summarization: age, gender, geography, race, sex, skin tone",Não,
A24US3Ge,"As a librarian, I want to provide my users with a powerful tool to explore the academic landscape and discover new research areas.",Library,clustering; matching,author,clustering: author | matching: —,Não,
A24US4Ge,"As a student, I want to easily find relevant publications and researchers for my research projects and assignments.",News,bias detection in word embeddings; clustering,textual references to people and their demographics; author; geography,"bias detection in word embeddings: textual references to people and their demographics | clustering: author, geography, textual references to people and their demographics",Não,
A24US5Ge,"As a university administrator, I want to gain insights into the research strengths and collaborations within my institution.",Movies,data summarization; ranking,age; gender,"data summarization: age, gender | ranking: age, gender",Não,
A24US6Ge,"As a research funder, I want to identify promising research areas and researchers for potential funding opportunities.",Movies,,,,Sim,
A24US7Ge,"As a data scientist, I want to explore the potential of ArnetMiner's data and network analysis for further research and development.",Health,representation learning,age; ethnicity; gender; geography; sex,"representation learning: age, ethnicity, gender, geography, sex",Não,
A24US8Ge,"As a developer of academic search engines, I want to integrate ArnetMiner's features and data to provide a more comprehensive and informative search experience.",Biology,,,,Sim,
A24US9Ge,"As a publisher, I want to leverage ArnetMiner's network analysis to understand the reach and impact of published research.",Music,,,,Sim,
A24US10Ge,"As a policymaker, I want to use ArnetMiner's insights to inform policies and initiatives that support research collaboration and innovation.",Finance & Marketing,classification; classification; representation learning,age; geography; race; sex; gender,"classification: age, geography, race, sex, gender | representation learning: age, gender, geography, race, sex",Não,
A24US1Ll,"As a researcher, I want to be able to search for other researchers with similar expertise and interests, so that I can collaborate with them and expand my professional network.",Health,representation learning,age; ethnicity; gender; geography; sex,"representation learning: age, ethnicity, gender, geography, sex",Não,
A24US2Ll,"As a developer, I want to design a system that can automatically extract researcher profiles from the Web, so that I can build a comprehensive database of academic researchers.",Medicine,classification; classification,age; race; sex; ethnicity; gender,"classification: age, race, sex, ethnicity, gender",Não,
A24US3Ll,"As a librarian, I want to integrate publication data from existing digital libraries into a unified academic social network, so that I can provide a single platform for researchers to access and share information.",Library,,,,Sim,
A24US4Ll,"As a data scientist, I want to develop a probabilistic framework to deal with the name ambiguity problem in academic networks, so that I can accurately match researchers with their publications.",Health,classification; representation learning,age; geography; sex; ethnicity; gender,"classification: age, geography, sex, ethnicity, gender | representation learning: age, ethnicity, gender, geography, sex",Não,
A24US5Ll,"As a researcher, I want to be able to search for people with specific expertise or areas of interest, so that I can identify potential collaborators or mentors.",Health,representation learning,age; ethnicity; gender; geography; sex,"representation learning: age, ethnicity, gender, geography, sex",Não,
A24US6Ll,"As a developer, I want to design a unified modeling approach to simultaneously model topical aspects of papers, authors, and publication venues, so that I can provide a comprehensive view of the academic network.",Biology,classification; graph mining,,classification: — | graph mining: —,Não,
A24US7Ll,"As a researcher, I want to be able to visualize the academic network and identify patterns and relationships between researchers, publications, and venues, so that I can gain insights into the field.",Medicine,classification; classification,age; race; sex; ethnicity; gender,"classification: age, race, sex, ethnicity, gender",Não,
A24US8Ll,"As a system administrator, I want to ensure that the system can handle a large volume of data and scale to accommodate a growing number of users, so that I can provide a reliable and efficient service.",Law,,,,Sim,
A24US9Ll,"As a researcher, I want to be able to search for research papers and publications based on specific keywords or topics, so that I can stay up-to-date with the latest research in my field.",Health,,,,Sim,
A24US10Ll,"As a developer, I want to evaluate the performance of the ArnetMiner system using empirical methods, so that I can identify areas for improvement and refine the system to better meet the needs of users.",Biology,,,,Sim,
A24US1O1,"As a researcher, I want automated extraction of my profile from the Web, so that my academic information is accurately represented in the ArnetMiner system.",Biology,classification; graph mining,,classification: — | graph mining: —,Não,
A24US2O1,"As a digital library manager, I want to integrate publication data into the academic network, so that the system provides a comprehensive view of research outputs.",Computer Networks,,,,Sim,
